{
  "registry_version": "phase34-market-data-source-v1",
  "model_weight_training": "NO",
  "current_optimization": "PROMPT_RETRIEVAL_RERANKER_TOOL_CALIBRATION_AND_MODEL_SELECTION",
  "label": "Phase 34 rights-aware market-data source registry",
  "generated_at": "2026-07-19T00:00:00.000Z",
  "sources": [
    {
      "source_id": "fp-records",
      "source_name": "Platform catalog records",
      "source_owner": "record-platform",
      "source_type": "FIRST_PARTY_CATALOG",
      "access_method": "INTERNAL_DB",
      "credentials_reference": "none",
      "rights_status": "FIRST_PARTY",
      "license": "FIRST_PARTY_PLATFORM",
      "terms_verified_at": "2026-07-19",
      "allowed_uses": [
        "retrieval",
        "analytics",
        "display",
        "evidence_snapshots",
        "prompt_grounding"
      ],
      "prohibited_uses": [
        "model_weight_training",
        "cross_tenant_leakage",
        "redistribution_outside_product"
      ],
      "allowed_fields": [
        "record_id",
        "artist",
        "title",
        "label",
        "catalog_number",
        "barcode",
        "format",
        "release_year",
        "pressing_attributes"
      ],
      "prohibited_fields": [],
      "retention_policy": "product_lifecycle_with_deletion_honored",
      "cache_policy": "bounded_ttl_with_invalidation_on_write",
      "refresh_policy": "event_driven_plus_periodic_reconcile",
      "attribution_requirement": "none_internal",
      "commercial_use_status": "ALLOWED_SCOPED",
      "model_training_status": "NOT_AUTHORIZED_FOR_WEIGHT_TRAINING",
      "retrieval_use_status": "ALLOWED",
      "analytics_use_status": "ALLOWED",
      "display_use_status": "ALLOWED",
      "connector_status": "ENABLED",
      "approval_reference": "phase34-first-party-platform-data",
      "contact_reference": "platform-data-steward",
      "notes": "Authoritative first-party catalog identity surface for marketplace entities."
    },
    {
      "source_id": "fp-collections",
      "source_name": "User collections",
      "source_owner": "record-platform-user",
      "source_type": "USER_COLLECTION",
      "access_method": "INTERNAL_DB_SCOPED",
      "credentials_reference": "none",
      "rights_status": "USER_AUTHORIZED",
      "license": "USER_AUTHORIZED_SCOPED",
      "terms_verified_at": "2026-07-19",
      "allowed_uses": [
        "retrieval_scoped",
        "analytics_scoped",
        "display_scoped",
        "evidence_snapshots_scoped"
      ],
      "prohibited_uses": [
        "model_weight_training",
        "cross_user_access",
        "bulk_export_without_authorization"
      ],
      "allowed_fields": [
        "collection_item_id",
        "user_id_scoped",
        "release_id",
        "pressing_id",
        "condition",
        "acquired_at",
        "notes_user"
      ],
      "prohibited_fields": [
        "other_users_collections"
      ],
      "retention_policy": "user_deletion_and_retention_policy",
      "cache_policy": "user_scoped_short_ttl",
      "refresh_policy": "on_user_mutation",
      "attribution_requirement": "user_privacy_scoped",
      "commercial_use_status": "ALLOWED_SCOPED",
      "model_training_status": "NOT_AUTHORIZED_FOR_WEIGHT_TRAINING",
      "retrieval_use_status": "ALLOWED_SCOPED",
      "analytics_use_status": "ALLOWED_SCOPED",
      "display_use_status": "ALLOWED_SCOPED",
      "connector_status": "ENABLED",
      "approval_reference": "phase34-user-authorized-scope",
      "contact_reference": "privacy-steward",
      "notes": "Only the authorizing user's collection may enter evidence snapshots."
    },
    {
      "source_id": "fp-seller-inventory",
      "source_name": "Seller inventory",
      "source_owner": "record-platform-seller",
      "source_type": "SELLER_INVENTORY",
      "access_method": "INTERNAL_DB_SCOPED",
      "credentials_reference": "none",
      "rights_status": "USER_AUTHORIZED",
      "license": "USER_AUTHORIZED_SCOPED",
      "terms_verified_at": "2026-07-19",
      "allowed_uses": [
        "retrieval_scoped",
        "analytics_scoped",
        "display_scoped",
        "evidence_snapshots_scoped"
      ],
      "prohibited_uses": [
        "model_weight_training",
        "cross_seller_leakage"
      ],
      "allowed_fields": [
        "inventory_item_id",
        "seller_id_scoped",
        "release_id",
        "pressing_id",
        "quantity",
        "asking_price",
        "condition",
        "availability_status"
      ],
      "prohibited_fields": [
        "other_sellers_private_cost_basis"
      ],
      "retention_policy": "seller_deletion_and_retention_policy",
      "cache_policy": "seller_scoped_short_ttl",
      "refresh_policy": "on_inventory_mutation",
      "attribution_requirement": "seller_privacy_scoped",
      "commercial_use_status": "ALLOWED_SCOPED",
      "model_training_status": "NOT_AUTHORIZED_FOR_WEIGHT_TRAINING",
      "retrieval_use_status": "ALLOWED_SCOPED",
      "analytics_use_status": "ALLOWED_SCOPED",
      "display_use_status": "ALLOWED_SCOPED",
      "connector_status": "ENABLED",
      "approval_reference": "phase34-user-authorized-scope",
      "contact_reference": "privacy-steward",
      "notes": "Seller inventory is user-authorized and must remain seller-scoped."
    },
    {
      "source_id": "fp-marketplace-listings",
      "source_name": "Marketplace listings",
      "source_owner": "record-platform",
      "source_type": "MARKETPLACE_LISTING",
      "access_method": "INTERNAL_DB",
      "credentials_reference": "none",
      "rights_status": "FIRST_PARTY",
      "license": "FIRST_PARTY_PLATFORM",
      "terms_verified_at": "2026-07-19",
      "allowed_uses": [
        "retrieval",
        "analytics",
        "display",
        "evidence_snapshots",
        "asking_price_context"
      ],
      "prohibited_uses": [
        "model_weight_training",
        "treat_asking_as_completed_sale"
      ],
      "allowed_fields": [
        "listing_id",
        "seller_id",
        "release_id",
        "pressing_id",
        "asking_price",
        "currency",
        "condition",
        "listing_status",
        "listed_at",
        "updated_at"
      ],
      "prohibited_fields": [],
      "retention_policy": "product_lifecycle_with_deletion_honored",
      "cache_policy": "bounded_ttl_with_listing_invalidation",
      "refresh_policy": "event_driven",
      "attribution_requirement": "none_internal",
      "commercial_use_status": "ALLOWED_SCOPED",
      "model_training_status": "NOT_AUTHORIZED_FOR_WEIGHT_TRAINING",
      "retrieval_use_status": "ALLOWED",
      "analytics_use_status": "ALLOWED",
      "display_use_status": "ALLOWED",
      "connector_status": "ENABLED",
      "approval_reference": "phase34-first-party-platform-data",
      "contact_reference": "platform-data-steward",
      "notes": "ASKING_LISTING events only; never substitute for COMPLETED_SALE."
    },
    {
      "source_id": "fp-completed-sales",
      "source_name": "Completed first-party sales",
      "source_owner": "record-platform",
      "source_type": "COMPLETED_SALE",
      "access_method": "INTERNAL_DB",
      "credentials_reference": "none",
      "rights_status": "FIRST_PARTY",
      "license": "FIRST_PARTY_PLATFORM",
      "terms_verified_at": "2026-07-19",
      "allowed_uses": [
        "retrieval",
        "analytics",
        "display",
        "evidence_snapshots",
        "valuation_grounding"
      ],
      "prohibited_uses": [
        "model_weight_training",
        "expose_buyer_pii_outside_authorization"
      ],
      "allowed_fields": [
        "sale_id",
        "listing_id",
        "release_id",
        "pressing_id",
        "final_price",
        "currency",
        "sold_at",
        "condition",
        "sale_type"
      ],
      "prohibited_fields": [
        "buyer_payment_instruments"
      ],
      "retention_policy": "product_lifecycle_with_deletion_honored",
      "cache_policy": "immutable_sale_row_with_correction_chain",
      "refresh_policy": "append_only_with_corrections",
      "attribution_requirement": "none_internal",
      "commercial_use_status": "ALLOWED_SCOPED",
      "model_training_status": "NOT_AUTHORIZED_FOR_WEIGHT_TRAINING",
      "retrieval_use_status": "ALLOWED",
      "analytics_use_status": "ALLOWED",
      "display_use_status": "ALLOWED",
      "connector_status": "ENABLED",
      "approval_reference": "phase34-first-party-platform-data",
      "contact_reference": "platform-data-steward",
      "notes": "Primary completed-sale corpus for Phase 34 market evidence."
    },
    {
      "source_id": "fp-offers",
      "source_name": "Offers",
      "source_owner": "record-platform",
      "source_type": "OFFER_EVENT",
      "access_method": "INTERNAL_DB_SCOPED",
      "credentials_reference": "none",
      "rights_status": "USER_AUTHORIZED",
      "license": "USER_AUTHORIZED_SCOPED",
      "terms_verified_at": "2026-07-19",
      "allowed_uses": [
        "retrieval_scoped",
        "analytics_scoped",
        "display_scoped",
        "negotiation_evidence"
      ],
      "prohibited_uses": [
        "model_weight_training",
        "cross_thread_leakage",
        "treat_unknown_accepted_obo_as_known_final_price"
      ],
      "allowed_fields": [
        "offer_id",
        "listing_id",
        "offer_amount",
        "currency",
        "offer_status",
        "created_at",
        "resolved_at"
      ],
      "prohibited_fields": [
        "unrelated_thread_offers"
      ],
      "retention_policy": "user_deletion_and_retention_policy",
      "cache_policy": "thread_scoped_short_ttl",
      "refresh_policy": "on_offer_mutation",
      "attribution_requirement": "participant_privacy_scoped",
      "commercial_use_status": "ALLOWED_SCOPED",
      "model_training_status": "NOT_AUTHORIZED_FOR_WEIGHT_TRAINING",
      "retrieval_use_status": "ALLOWED_SCOPED",
      "analytics_use_status": "ALLOWED_SCOPED",
      "display_use_status": "ALLOWED_SCOPED",